Column1,Manual.summary,Classification Joaquin,Classification Rui,Classification Ed,Average_Classification
36,Oesterreichische Nationalbank Governor  Robert Holzmann  told the Austrian public broadcaster ORF on Sunday that the  ECB  may have to accept a moderate recession to stem price pressures if it sees signals that inflation expectations are rising. He added that hopefully that will not be necessary and the size of the next hike will depend on developments in the economic outlook.  ECB  President  Christine Lagarde  has promised to raise interest rates for as long as it takes to return inflation to the 2% target.,1,1,1,1.0
37,"The proposal to cap gas prices in the  European  Union ( EU ), which divides member states, has put the  ECB  on alert.  ECB  President  Christine Lagarde  fears an increase in market volatility, with a risk to the financial stability of the euro area. On Friday, the  ECB  warned that the cap could increase volatility and cause margin calls to soar, i.e. the amounts that market operators have to block to guarantee their transactions, at the risk of not having enough liquidity. It could even undermine the ability of central counterparties (in regulated markets) to manage financial risks. The  ECB 's criticism comes as the  EU  member states struggle to agree on the  European  Commission's proposal. It will be on the agenda of a new meeting of energy ministers on Tuesday.",0,0,0,0.0
38,"The  ECB  decided to maintain interest rates at 4.5% for the fourth consecutive month on Thursday despite the economic weakness in the euro area.  ECB  President  Christine Lagarde  highlighted the good progress in the disinflation process but said more evidence was needed. Inflation fell by 0.2 percentage points in February to 2.6%, while underlying inflation contracted to 3.1%, according to Eurostat data. These figures are beginning to approach the  ECB 's 2% target. The  ECB 's new forecasts confirm the downward trend in inflation and economic growth weakness. Therefore, the  central bank  lowered its average inflation forecasts for the euro area to 2.3% in 2024 and 2% in 2025 while maintaining it at 1.9% for 2026.",1,1,1,1.0
39,"In a lecture at the Frankfurt School of Finance and Management, Banca d'Italia Governor  Ignazio Visco  emphasised the need for the  ECB  to decide on the speed of future rate increases based on data and their effect on inflation forecasts.  ECB  President  Christine Lagarde  and Chief Economist Philip Lane have also recently addressed data's relevance.Â Mr Visco recognised the importance of tightening the monetary policy stance to prevent a temporary increase in inflation caused by supply shocks from becoming a persistent problem fueled by demand-related factors. However, unlike Deutsche Bundesbank President  Joachim Nagel ,  Mr Visco did not indicate that further significant rate hikes would be necessary beyond March. Instead, he advised exercising caution.Â Mr Visco reiterated that it is essential for the  ECB  to continue balancing the risks of doing too little with those of excessive tightening that would lead to significant repercussions for economic activity, financial stability and medium-term price development.",0,1,1,0.6666666666666666
40,"Italy is heading for a conflict with the  EU  over the implementation of the  European  reconstruction  programme . Several ministers in the new government are calling for both an increase in funding, although Italy is already the biggest beneficiary of the  programme  with a total of EUR 191.5 billion, and longer deadlines for implementation. The situation is being observed very closely in the  ECB , and at times with some concern. The euro guardians fear that the reform process in the third largest euro economy will come to a standstill or that progress will even be reversed. Only on Monday did  ECB  President  Christine Lagarde  warn in the  European  Parliament that Italy had to push through the reforms that are required in return for the  EU  funds. ""It's a great opportunity to demonstrate that from the fiscal and structural standpoint, there can be a strong determination to pull Italy into that improved economic situation going forward,"" Ms Lagarde said. The  ECB  is also concerned that new turbulence in Italy could affect the normalisation of monetary policy envisaged because of record inflation. Not least with a view to Italy, the  ECB  Governing Council launched the new bond purchase  programme  Transmission Protection Instrument (TPI) to counteract excessive yield differences. If it were activated, however, there could again be controversial debates among the euro  central bankers .",0,0,1,0.3333333333333333
41,ECB  Executive Board Member  Fabio Panetta  is sceptical about further interest rate increases in the euro area. Mr Panetta believes the  ECB  has already entered the phase of declining inflation rates.,-1,-1,-1,-1.0
42,"At a Riksbank conference held on 10 January, US Federal Reserve Chair Jerome Powell argued that the  central bank  would not become a climate policymaker or get involved in matters beyond its jurisdiction. Meanwhile,  ECB  Executive Board Member  Isabel Schnabel  asserted that the  ECB  needed to adjust its policy approach to become more climate-friendly by moving from a flow-based to a stock-based tilting bond portfolio approach.  ECB  Governing Council Member  Pierre Wunsch  contested her comments and asserted that the fight against climate change should be left to the governments. Moreover, Bank of Japan Governor Haruhiko Kuroda shared this scepticism, adding that climate-centred policies must remain within  central banks ' mandates. Bank of England Governor Andrew Bailey also had a hawkish stance.Â ",0,0,0,0.0
43,"The  European  Commission last week approved the latest state aid scheme to assist businesses in Ireland, this time with energy costs during the winter months. In interviews in this newspaper, Finance Minister Paschal Donohoe and  Central Bank  of Ireland Governor  Gabriel Makhlouf  warn that the era of government support for businesses must come to an end. “We cannot continue with Covid-era responses to every economic difficulty the country might encounter — because if we do that, we’ll create our own crisis and our own difficulty,” Mr Donohoe said. Mr Makhlouf also urges caution over expectations that the government should continue to support struggling businesses. Not every business succeeds, he points out — firms quite naturally close. Resources using those firms then move to more productive uses. “From an economic perspective — and from the perspective of the entire community as a whole — that is a good thing,” he stressed.",-1,-1,-1,-1.0
44,"Angela Merkel has been awarded the highest distinction of the state of North Rhine-Westphalia in Cologne. Minister President Hendrik Wüst and the entire regional government congratulated Ms Merkel. In his speech, Mr Wüst recalled the banking crisis, the euro crisis, how Ms Merkel dealt with the refugees and also the coronavirus pandemic.  ECB  President  Christine Lagarde  also gave a laudatory speech in which she emphasised the role of Chancellor Adenauer and Charles de Gaulle for the reconciliation between France and Germany and also the nucleus of the  European  project.",0,0,0,0.0
45,"The  ECB  is not quite done with its interest rate hikes, but it is not far from the final target,  ECB  Executive Board member  Fabio Panetta  said in an interview with French daily Le Monde. ""I think that now is not the time to act too quickly because we have already come a long way,"" Mr Panetta said. With inflation slowing but still very high, the  ECB  is expected to raise rates again by a quarter point each in June and July. According to Mr Panetta, inflation is too high, but there is no reason for concern. Monetary tightening will be felt in the coming months, he pointed out. The possibility that domestic demand will remain weak and that this will translate into continued economic weakness or even a technical recession in the euro area cannot be ruled out, he noted.",1,1,1,1.0
46,"In a guest contribution, PIMCO Portfolio Manager Konstantin Veit argues that underlying price pressures in the euro area remain persistent. Mr Veit expects the  ECB  to raise interest rates by 50 basis points in February and March, with a possible switch to 25 basis points in May. The  ECB  Governing Council will most likely make it clear that tightening policy may be warranted for a longer period than the market currently expects. He points out that the  ECB  remains concerned about wage dynamics, fiscal policy and market-based financing conditions, and if the resilience continues, it may have to tighten policy even more. Furthermore, the  ECB  has limited room to think about trade-offs between QT and policy rates, which means QT will likely be a fairly mechanical background  programme . In his view, no market-moving surprises are expected in the details for the reduction of APP holdings. He concludes that  ECB  Executive Board Member  Isabel Schnabel 's recent speech indicated the  ECB  intends to institutionalise the current excess liquidity framework rather than reintroduce the benchmark allocation system from before the global financial crisis.",1,1,1,1.0
47,"The  ECB  delivered another 75 basis points interest hike on 27 October.  ECB  President  Christine Lagarde  said at a news conference in Frankfurt during the day that inflation remained too high and would stay above its target for an extended period. She added that the  central bank ’s policy stance was aimed at weakening the forces pushing up demand and at guarding against the risk of inflation expectations persistently shifting higher. However, the  ECB  provided few details about the path of rate hikes. Ms Lagarde said the  central bank  had made ''substantial'' progress in withdrawing easy money from the euro area, and the number and magnitude of upcoming moves would be determined by data at each policy meeting. The  ECB  also announced it was changing the terms of the loans it offered to banks during the Covid-19 pandemic to reflect its tighter monetary policy stance. ",1,1,1,1.0
48,"An analysis writes that the  ECB ’s pausing monetary tightening after the May interest rate hike might have seemed natural considering that the  central bank  has raised rates by the most in its history, the euro area economy is barely growing and banks are turning off the credit taps. However, euro area inflation is still high.  ECB  President  Christine Lagarde  said after last week’s rate hike that the  central bank  had more ground to cover in monetary tightening. She added that rates were not yet “sufficiently restrictive” to return inflation to the 2% target. Pictet Wealth Management Head of Macroeconomic Research Frederik Ducrozet said he expected the  ECB  to raise rates 25 basis points in June and possibly in July depending on developments in the US banking system. Yet, Ms Lagarde dismissed the notion that the  ECB  was dependent on the US Federal Reserve’s decisions. ",1,1,1,1.0
49,"The PMI for the overall economy in Germany fell surprisingly sharply in June by 3.1 points to 50.8, signalling the weakest economic growth in four months. The barometer is now only just above the growth threshold of 50 points. This fits in with the fact that more and more bond investors are betting on a deep recession. ""The signals cannot be ignored that the  central banks  are prepared to raise interest rates to a level at which something could go bust or at least a more severe economic slump will follow,"" said Commerzbank investment strategist Christoph Rieger. The  ECB  began its series of monetary tightening measures last summer and recently completed its eighth consecutive rate hike. It is likely to follow suit in July. According to Deutsche Bundesbank President  Joachim Nagel , interest rates could possibly rise even after the summer break. In his view, it would be a cardinal mistake to end the fight against high inflation too early. In view of the escalating inflation, it was also right that the  ECB  had slowed down economic development with its tighter course. Industry in Germany, the largest economy in the euro area, has long since gone into reverse gear: ""In manufacturing, all signs point to a recession in the second quarter, while a slowdown in growth is noticeable in the service sector,"" said Chief Economist Cyrus de la Rubia of Hamburg Commercial Bank, which sponsored the survey.",1,1,1,1.0
50,"On Wednesday, Banco de Portugal Governor  Mário Centeno  responded emphatically to questions from journalists regarding his analysis of the Portuguese economy at the beginning of September, highlighting that the analysis is part of a principle of ""being closer"" established over the last three years at Banco de Portugal. Mr Centeno also added that his analysis presented the challenges facing the national economy.",0,0,0,0.0
51,"Markets have interpreted the  ECB 's interest rate message as relatively dovish despite the 75 basis point interest rate hike, with a shift away from an exclusive focus on inflation, the Barclays rate strategist team has said.  ECB  President  Christine Lagarde  mentioned three factors in particular that will be crucial to the future path of rates: the inflation outlook, the extent of recession risks and the magnitude of the tightening already in place and the lag of its transmission to the real economy, the strategists noted. ""Overall, this represents a significant shift from the single focus on inflation at the September meeting"", they commented. ",-1,-1,-1,-1.0
52,"In an interview with Bloomberg TV, Banco Santander President Ana Botín stated that the recent collapses of medium-sized banks in the US and Credit Suisse in  Europe  do not signify a systemic crisis and emphasised that the current situation differs from the 2008 financial crisis. Ms Botín highlighted that global banks now have higher capital levels, and the risks have shifted away from the banking system. She predicted that interest rates would remain stable or potentially increase, as  central banks  have limited options to control inflation and prevent a recession. In a separate statement,  ECB  Vice-President  Luis de Guindos  acknowledged the stability of the non-bank financial sector in the  EU , including funds and insurance companies, despite recent turbulence.",1,1,0,0.6666666666666666
53,"The Supervisory Board of the  ECB  will meet on 17 March in Frankfurt for an extraordinary meeting to analyse the turbulence in  Europe 's financial markets. The meeting comes after the institution assured that it is prepared to offer all the necessary liquidity to the markets if necessary. The Supervisory Board is meeting to exchange views and update members on recent events in the banking sector, says a spokesman for the  central bank .",0,0,0,0.0
54,"ECB  President  Christine Lagarde  acknowledges that the economic situation is set to get worse. Furthermore, she stresses that fiscal support measures for protecting vulnerable households should be ""temporary and targeted"", thereby limiting the risk of fuelling more inflation. Portuguese President Marcelo Rebelo de Sousa calls Ms Lagarde's speech an ""abrupt shift"" from looking to inspire confidence and limit  ECB  intervention to a ""dramatic and perhaps depressive"". He says that economic results from Q3 and Q4 could be complicated and hopes that they will not spell a return to the stagflation of the 1970s.",1,1,1,1.0
55,"An editorial piece points out that the number of bankruptcies is expected to rise this year. Inflation and high interest rates reduce the consumers' ability to use services and products, and the companies' ability to do business. The economic uncertainty makes the situation more difficult. The euro area inflation rate is still higher than the  ECB 's goal. The inflation rate slowed down to 5.3% in July, but the underlying inflation rate is still 5.5%. In July, the  ECB  raised its interest rate to 3.75%.  ECB  President  Christine Lagarde  said that the  ECB  will not be lowering its interest rate in September. The alternatives are to raise the interest rate further or keep it unchanged. Some economists still expect a 0.25% hike in September. According to Bloomberg's consensus, another hike is beginning to look more unlikely. ",1,1,1,1.0
56,"On Público's P24 podcast, journalist Sérgo Aníbal comments that after the  ECB ’s last interest rate increase in July, the inflation outlook kept worsening and led to its latest 75 basis point increase last week, which was expected for a while. He points out that the  central bank  has come a long way from claiming that inflation was transitory and its current drive to act fast and front-load is clearly driven by concern about the risk of euro area inflation becoming entrenched. Its latest forecast also reflects such a risk. Mr Aníbal says that current inflation, unlike in the past, is caused mainly by external factors and as such understandably raises doubts about the potential of such strong steps by the  ECB  to impact inflation rates. Regarding the claim that  ECB  is lagging behind the US Federal Reserve, Mr Aníbal stresses that the two economies and their inflation challenges are very different.",1,1,1,1.0
57,"In a speech on Monday,  ECB  President  Christine Lagarde  refrained from giving any indication about what decision on interest rates the  central bank  might take at the upcoming monetary policy meeting. She stressed that the  ECB  has raised policy rates by a total of 425 basis points in the past year, which was an unprecedentedly rapid tightening cycle for the  central bank , and reiterated the  ECB 's commitment to reaching the 2% medium-term inflation target in a timely manner, Bloomberg reports. Markets are now pricing in a 25% chance that the  ECB  will raise interest rates by a quarter of a percentage point at its next meeting. This is a significant shift from the previous 60% probability, which was based on data showing higher core inflation in the euro area.",1,1,1,1.0
58,"In an interview with the Financial Times, Banque Nationale de Belgique Governor  Pierre Wunsch  said that he would only agree to raise interest rates if wage growth starts to slow down and warned that euro area interest rates could reach 4%. He believes that investors are still underestimating the cost of borrowing, as they are counting on the  ECB  to raise interest rates to slightly above 3.75%.“I’m not a fetishist,” he said and added: “I am not going to hike rates even in a recession just because we have 2.3% or 2.1% inflation in the two-year forecast. But I am not seeing inflation numbers going in the right direction yet.”",-1,1,-1,-0.3333333333333333
59,"On 26 October, the  ECB  left interest rates unchanged at 4.5%. At the press conference following the monetary policy meeting,  ECB  President  Christine Lagarde  emphasised that economic growth in the euro area will remain weak in 2023. However, the impact of the monetary policy transmission is already visible, especially in the banking sector, she added. Ms Lagarde also pointed out that the  ECB  Governing Council discussed neither the  PEPP   programme  nor minimum reserve requirements.",1,0,0,0.3333333333333333
60,"On Friday,  ECB  President  Christine Lagarde  said the fall in inflation in the euro area, to 2.9% in October, is encouraging but cannot be taken for granted, given the uncertainty over the future trend in energy prices. Much of the significant fall in the inflation rate in recent months is linked to a fall in energy prices, which is explained by a base effect compared to the sharp rises recorded in October 2022. These effects will not recur in the coming months, so it is necessary to really watch energy prices in the future, Ms Lagarde stressed. Regarding how long rates will remain unchanged, Ms Lagarde said long enough is long enough, and regarding a change in rates, this is not something that will happen in the next few quarters. At the same time, the  ECB  wants to retain the flexibility to act, and will make up its mind at its next meetings based on the available data, Ms Lagarde repeated. In this respect, it will be looking at the behaviour of inflation, particularly excluding energy prices, and the spread of the effects of high interest rates on the economy.",1,1,0,0.6666666666666666
61,"The  ECB  has maintained stagnant interest rates, providing no immediate respite for Irish households and businesses. Asserting any conversation on rate cuts was ""totally, totally premature"",  ECB  President  Christine Lagarde  confirmed this topic was not deliberated upon by the Governing Council during its latest rate-setting decision. The  ECB , which had commenced rate augmentation in July to address surging inflation, confirmed its three rates stood at 4.5%, 4.75% and 4%, respectively. There is speculation in the financial markets about when next year the  ECB  will initiate interest rate cuts. Mortgage broker Michael Dowling and Stephen Hamilton, Managing Director of MortageLine, warned that the reductions would not occur swiftly enough to support 70,000 Irish households when their fixed-rate mortgages lapse at year's end. Meanwhile, the euro area is potentially on the precipice of a recession, with Germany's output possibly decreasing and a downturn in the services sector and job market. Despite the lacklustre economic outlook, the  ECB 's official statement argues that maintained rates would significantly aid its goal. Jack Allen-Reynolds, Capital Economics' Deputy Chief Eurozone Economist, anticipates the  ECB  to retain current interest rates well into the next year.",1,1,0,0.6666666666666666
62,"European  and Italian banks are showing important signs of recovery. Profitability is growing. In the first nine months of 2022, the return on capital increased by 0.7% compared to 2021, to 8.7%, Banca d'Italia Governor  Ignazio Visco  reported. From 2006 to 2021, the capitalisation of Italian banks more than doubled, jumping from 7.7% to 16.6%. Since 2007, shareholders in Italy alone have injected some EUR 76 billion into their banks in capital increases. Today, however, the Supervisory Authority continues to keep the attention high, and this is a delicate task because it should always look ahead and anticipate risks that operators do not see. And what has been done in recent years shows that progress has been possible with the  ECB 's contribution.",0,0,0,0.0
63,"The Paris Stock Exchange is set to open sharply higher on Thursday, welcoming the US Federal Reserve's decision to maintain its key interest rates, with the majority of its members forecasting rate cuts in 2024. On Wednesday evening, the Fed kept rates within a range of 5.25% to 5.50%. A majority of Fed officials anticipate three or four rate cuts in 2024, bringing them to 4.6% by the end of 2024. Fed Chairman Jerome Powell warned that Fed officials have not ruled out the possibility of raising rates again, but he also acknowledged that the monetary committee has discussed the start of a timetable for rate cuts. In  Europe , analysts are expecting the  ECB  to maintain its policy stance, but the biggest challenge facing  ECB  President  Christine Lagarde  this Thursday is to convince the market that rate cuts will not begin until the summer of 2024, given that  Europe 's economy is already in a very bad state, CMC Markets Analyst Michael Hewson said.",0,0,1,0.3333333333333333
64,"In an interview with radio broadcaster RNE,  ECB  Vice-President  Luis de Guindos  said that, after seven consecutive interest rates hikes, the “final stretch” of the cycle is drawing near. The hikes of 25 basis points are now the “new norm,” Mr de Guindos also said. The forthcoming rate hikes will depend on incoming data, the new macroeconomic projections and monetary policy transmission, he reiterated. In the coming three or four years at least, interest rates will be standing at positive levels, unlike the abnormal situation of the previous years.",1,0,0,0.3333333333333333
65,"Hopes of a bottoming out are spreading in the crypto market after the recent market turmoil. Although the prices of the leading cyber currencies Bitcoin and Ether fell again in midweek, blockchain data are encouraging investors. However, uncertainty continues to spread in the crypto market after the collapse of the FTX trading platform.  Meanwhile,  ECB  Executive Board member  Fabio Panetta  on Wednesday described the promise of quick money with cryptocurrencies as a bubble that was doomed to burst. Now, he said, regulation was needed at the global level to protect consumers from the risks of digital assets. Panetta thus joined the chorus of  central bankers  like US Federal Reserve Vice Chair of Supervision Michael Barr, who are calling for a tougher approach to crypto assets.",0,0,0,0.0
66,"Bank of Greece Governor  Yannis Stournaras  said addressing the Economist conference The Seventh Sustainability Summit for SE  Europe  and the Mediterranean that the current situation of multiple crises should not slow down global efforts to achieve sustainable development. He emphasised that “in this demanding environment, the financial sector needs to remain resilient to possible macroeconomic and geopolitical shocks, supporting the economy, while taking measures to address the challenges related to digital transformation and climate change”. According to Mr Stournaras, the transition to a low-emission economy and adaptation to climate change still need significant reinforcement. He added that for the  European  economy, and especially for the euro area, there would be no definitive answer to the new major challenges without greater and wider fiscal consolidation, and the completion of the banking union.",0,0,0,0.0
