Column1,Manual.summary,Classification Joaquin,Classification Rui,Classification Ed,Average_Classification
67,"The only candidate proposed to replace  ECB  Executive Board Member  Fabio Panetta  when nominations closed on Wednesday was Italy’s nominee Piero Cipollone, a three-decade veteran of Banca d’Italia, Eurogroup President Paschal Donohoe said on Wednesday. Mr Cipollone has a reputation for discreetly helping Rome's eurosceptic government rub along with  EU  institutions and brings skills in economics, particularly in digital money, tempered with pragmatism, people who have worked with him say. He has been part of the task force led by Mr Panetta studying the creation of a digital euro. People familiar with him say the Deputy Governor of Banca d’Italia is a moderate and following in the footsteps of former  ECB  President Mario Draghi, Mr Cipollone is attentive to the real-world impact of policy as well as economic theory. ""Piero is from the same brood as Draghi and would bring to the  ECB  analytical and objective reasoning, devoid of ideological biases,"" former Banca d’Italia General Director Salvatore Rossi told Reuters.",0,0,0,0.0
68,ECB  President  Christine Lagarde  said on Friday that underlying inflation remains â,1,1,1,1.0
69,"At the  ECB 's interest rate meeting in Athens,  ECB  President  Christine Lagarde  reiterated that interest rates have reached a level that is sufficient to bring inflation back to the  central bank 's target of 2%. Ms Lagarde called it ""totally premature"" to discuss possible rate cuts in 2024, which economists interpreted as her not having a choice if she wants to avoid a significant market reaction. Ms Lagarde also stated that the  central bank  will keep interest rates high ""for a sufficiently long time,"" without specifying what that means. The  ECB 's colossal bond holdings, including the  PEPP  asset purchase  programme , are increasingly under the spotlight of investors and economists. The  ECB  plans to stop reinvesting money from the  PEPP   programme  at the end of 2024.",1,1,0,0.6666666666666666
70,"ECB  President  Christine Lagarde  met with 400  European  students in Florence as guests of the Permanent Observatory for Young Publishers. During her speech, Ms Lagarde was able to answer questions posed by young students concerning monetary policy and the stability of the  European  banking system. According to her, what happened to the Silicon Valley Bank (SVB) would not be repeated in  Europe  as the banking system in the euro area is much more robust and different from that of 2008, and regulations and stress tests involve more than 2000 credit institutions compared to 13 or 14 in the United States. Moreover, Ms Lagarde explained that there is no trade-off between price and financial stability. She reiterated that the  ECB  would continue to follow its mandate based on data due to geopolitical uncertainty, climate change and financial tensions.",0,0,0,0.0
71,"The market's expectations regarding the evolution of interest rates changed after yesterday's  ECB  meeting. Despite  ECB  President  Christine Lagarde 's cautious speech, the signals coming from the market are for a reduction in key rates in the first half of next year. Before the meeting, the 12-month Euribor fell to 3.719%. The three-month Euribor rose 0.007% to 3.932%, while the six-month Euribor fell 0.007% to 3.938%.",-1,-1,-1,-1.0
72,"Lietuvos bankas Chairman of the Board  Gediminas Šimkus  has noted that the monetary policy implemented by the  ECB , regularly increasing interest rates, is effective and this is shown by the results achieved. Given the past challenges posed by Russia's war against Ukraine and the pandemic, strategic patience and consistency are critical factors to ensure inflation declines, he said. The Governing Council of the  ECB  decided in mid-September to raise all three main interest rates by 25 basis points. This was the tenth increase in a row.  ECB  President  Christine Lagarde  said it was too early to say whether interest rates had peaked. Mr Šimkus hopes that the  ECB  has raised interest rates for the last time. According to him, this measure is necessary for the time being to fight high inflation.",1,1,1,1.0
73,"On Wednesday, euro area government bonds rose as the first inflation data from German states fuelled expectations that the  ECB 's tightening cycle will not be over soon. In North Rhine Westphalia (NRW), Germany's most populous state, consumer prices rose in August by 0.5% month-on-month and 5.9% year-on-year. Some analysts expect the  ECB  to pause interest rate hikes in September. However, after the NRW data, money markets priced a 60% chance of a 25 basis points rate hike in September. On Monday, Oesterreichische Nationalbank Governor  Robert Holzmann  saw a case for raising interest rates further if there are no big surprises in inflation data before the meeting.",1,1,1,1.0
74,"ECB  President  Christine Lagarde  has pointed out the possibility of further interest rate increases in the euro area due to ongoing inflation pressures. The aim is to bring inflation back to 2%. After years of near-zero and negative rates, the  ECB  has raised interest rates seven times since July 2022, with the current rate at 3.75%. The next rate hike is expected at the 15 June meeting. Speaking before the  European  Parliament's Economic and Monetary Policy Committee on Monday, Ms Lagarde highlighted that the rate increases have impacted financing conditions for businesses and households, leading to higher borrowing costs and reduced credit volumes. While the effects of monetary policy measures are being felt, there are no clear signs that underlying inflation has surpassed its peak. Ms Lagarde expressed optimism about the financial stability of the euro area banking sector, despite ongoing risks such as recent banking turbulence in the US and Switzerland.",1,1,1,1.0
75,"The  ECB  does not want to give up its ecological aspirations despite its fight against high inflation.  ECB  Executive Board member  Isabel Schnabel  already explained in January that the  central bank  will face a difficulty in continuously de-carbonising its portfolio once its asset purchases and re-investments are finalised. Although the process of searching for solutions is currently in a very preliminary phase, Ms Schnabel has already discussed the possibility of a re-adjustment of the stock of corporate debt in the hands of the  ECB . In this way, the bulk of the portfolio would be sought to be changed.",0,0,0,0.0
76,"Hundreds of thousands of households and businesses will be faced with a new increased mortgage or business loan or a bank overdraft at the same time, due to the  ECB ’s decision to raise interest at its Governing Council meeting on 15 December and expected to be the last of 2022. In a recent interview, Deutsche Bundesbank President  Joachim Nagel  and Banque de France Governor  François Villeroy de Galhau  stated that the  ECB 's battle against inflation will continue until the end of 2024 or 2025. During an interview with Milano Finanza,  ECB  Chief economist  Philip R. Lane  noted that the  ECB ’s increases will continue although inflation will slow down at a slow pace.",1,1,1,1.0
77,"Following the US Federal Reserve's rate hike, several  central banks  also tightened their monetary policies, a commentary notes. The Bank of England and Norges Bank raised rates by a quarter point, while the Swiss National Bank increased the rates by 0.50%. However, the recent decision to bail out Credit Suisse at the expense of bondholders has caused turbulence and shaken market confidence. Some believe  central banks  may disregard the credit world's stress, relying solely on safety nets and guaranteed liquidity. This line of reasoning is fraught with danger, as it is contingent on the assumption that no mishaps will occur. Recently Banca d'Italia Governor  Ignazio Visco  has called for a cautious approach, while the  ECB  hawks demand further tightening. US Treasury Secretary Janet Yellen's recent remarks on deposit guarantees have also created uncertainty. In light of the current events,  central banks  and politicians should remember the age-old adage ""confidence is a serious thing"" and exercise prudence in their statements.",0,1,0,0.3333333333333333
78,"The  ECB  Governing Council meets for another monetary policy meeting on Thursday. After eight consecutive rate hikes since July 2022, the  ECB  is expected to continue tightening to bring inflation back towards the 2% target in the medium term.  ECB  President  Christine Lagarde  will hold a press conference at 3 pm on Thursday. There are five main issues to watch out for - how big the rise will be, what to expect at the September meetings and beyond, the outlook for inflation over the next few months, if weak growth could influence future decisions and if the deterioration in credit conditions could be a factor. On Tuesday, De Nederlandsche Bank President  Klaas Knot  stated that a further rise after July was, at best a, possibility but by no means a certainty.",0,1,0,0.3333333333333333
79,"At the press conference following the  ECB  Governing Council meeting,  ECB  President  Christine Lagarde  acknowledged that the significant economic slowdown that the euro area is experiencing could end up in increased unemployment in the future. The labour market continued to perform well in the third quarter and the unemployment rate remained at a historically low level of 6.6% in August, Ms Lagarde stated. However, the  ECB  and Ms Lagarde’s main concern is high inflation. Inflationary pressures are becoming evident in more and more sectors of the economy, partly because of the high energy costs that are passed on across all of the economies. The long-term outlook is that inflation will subside to 2%, but certain indicators raise the concern that inflation can stay above target. Ms Lagarde also explained that discussions of  Quantitative Tightening  (QT) will take place in December.",1,1,1,1.0
80,"A painful recession was almost a foregone conclusion in view of the enormous rise in energy prices and the sharp interest rate hikes by the  ECB . However, now there are increasing glimmers of light that things will not be as bad as previously feared, a commentary reads. According to Bank Austria economist Walter Pudschedl, Austria will experience a mild recession in winter, partly caused by industry. The economic performance of the domestic industry is already shrinking, and there is no foreseeable turnaround in the near future. According to Bank Austria, the entire euro area will also experience a so-called technical recession. De Nederlandsche Bank President and  ECB  Governing Council Member  Klaas Knot  is not convinced of that. ""It is not yet a foregone conclusion that we will have a recession,"" he said. In his words, weaker growth is still needed to move inflation back to target. ""We must not give up too soon and we must not declare victory too soon,"" Mr Knot pointed out.",1,0,1,0.6666666666666666
81,"According to Vanguard experts, interest rate rises in the US may soon come to a halt, while in  Europe , the resilient economy and persistent inflation may lead to even higher rates for a more extended period. The experts anticipate the US Federal Reserve to raise rates at the upcoming meeting, reaching a peak between 5.25% and 5.5%. The  ECB 's stance on interest rates is more evident in the euro area. Following the seventh consecutive rate hike by 25 basis points to 3.25%,  ECB  President  Christine Lagarde  emphasised that the cycle of rate hikes is not yet complete. Therefore, Vanguard expects the  ECB  to continue raising rates, reaching 3.75% to 4% in the near future. The Bank of England is also forecasted to increase rates to 4.75% or 5% and maintain those levels until 2024. Meanwhile, Q1 data indicated a strong performance in China, but the experts believe it represents the peak of activity for 2023, with GDP growth projected between 6% and 6.5% for the year.",1,1,1,1.0
82,"ECB  President  Christine Lagarde  says she would like to see that inflation peaked in October, but there is too much uncertainty in energy prices to assume that it actually has peaked. Speaking as a guest on Bloomberg, ARK Capital Management Chief Portfolio Manager Saed Abukarsh comments that the terminal rate for  Europe  would be around 4%. In his view, it depends on when the  ECB  feels the global recession. Mr Abukarsh suggests the  central bank  should be more reactive in terms of the policies of the United States (US) and China. He predicts the  ECB  could raise interest rates by 75 and another 75 basis points next year. According to him, the US is much better positioned for a soft landing, and so, he believes the euro will fall to around 0.90 against the US dollar. In his view, in 2023 the question is who can manage to cap inflation first, and the US is in a better position. ",1,1,0,0.6666666666666666
83,"On Thursday, the  ECB  raised interest rates for the eighth time in just 11 months by 25 basis points. Until now, successive rate hikes made little impact, but the latest Eurostat data, which showed a 0.1% fall in GDP in Q4 of 2022 and Q1 of 2023, indicated that something was changing. Unemployment is still at a record low, at 5.3%, but the transmission of monetary policy is slow and, as  ECB  Chief Economist Philip Lane said, the worst of its effects on the economy may be yet to come. Despite the eighth consecutive rise, core inflation is still far from the  ECB 's 2% target, and will not return to that level until 2025. According to  ECB  President  Christine Lagarde , wage pressures are becoming an increasingly important contributor to inflation. ",1,1,1,1.0
84,"An editorial states that the declining inflation dynamics in the United States (US) and  Europe  have caused many investors to bet on a faster end of the interest rate turnaround. This contrasts with the statements of  central bank  heads, who so far are not talking about interest rate cuts at all. Asked at the World Economic Forum whether the market might be underestimating the  ECB 's determination,  ECB  President  Christine Lagarde  replied: ""Interest rate optimists should reconsider their position"". The  ECB  has good reasons not to loosen the interest rate reins too soon: for one thing, monetary policy manages expectations. With its hesitation, the  ECB  had gambled away investors' trust. Huge amounts of money flowed into the US and caused the euro to fall below parity against the dollar.Â Currency stability, however, is one of the  ECB 's core tasks, and confidence in Ms Lagarde and the  ECB  was severely damaged. A mistake the  ECB  probably does not want to repeat. In addition, the labour market and the economy in  Europe  remain robust. The  ECB  and the US Federal Reserve are meeting this week and should reveal more about their medium-term strategy.",1,1,1,1.0
85,"In a press conference after the monetary meeting on 2 February,  ECB  President  Christine Lagarde  saidÂ that the Governing Council discussions had been characterised by a willingness to show monetary policy continuity, as indicated in December.Â ",1,1,0,0.6666666666666666
86,"Central Bank  of Cyprus Governor  Constantinos Herodotou  stressed the importance of taming inflation during the 14th Limassol Economic Forum. He acknowledged the challenging monetary policy decisions made by the  ECB  to address high inflation, highlighting their necessity. Mr Herodotou argued that unchecked inflation would have more severe consequences for households and businesses, underlining the importance of eventually returning to a neutral monetary policy stance once a sustainable 2% inflation target is achieved in the medium term. He expressed confidence in the effectiveness of monetary policy transmission, citing a notable drop in inflation in September.  ECB  projections suggest a decline in inflation for the coming years, with estimates of 5.6% in 2023, 3.2% in 2024, and 2.1% in 2025.",1,1,1,1.0
87,"The  ECB  will meet on Wednesday to finally decide which candidate to support to succeed Andrea Enria as head of the body's Supervisory Board: Banco de España Deputy Governor Margarita Delgado or Deutsche Bundesbank Vice-President Claudia Buch. The decision will be taken by the  ECB 's Governing Council. Although the  ECB 's appointment carries almost total weight, it is not the  ECB 's decision. The candidate chosen by the  ECB  will have to undergo the approval of both the  European  Parliament and the Council of the  European  Union. The traditional informal and unwritten balance of senior officials in Spain, Italy, Germany and France would be affected, pending who will be the candidate to succeed both  ECB  Vice-President  Luis de Guindos , when his term expires in 2026, and  ECB  President  Christine Lagarde  in 2027.",0,0,0,0.0
88,"It will be a hot month for  central bankers  in  Europe  and the US.  ECB  President  Christine Lagarde  and US Federal Reserve Chair Jerome Powell will probably spend their respective August holidays in front of their monitors, waiting for the flurry of macroeconomic data that will accompany them to the two crucial dates of 14 and 20 September when first the  ECB  and then the Fed will present their monetary policy decisions. In its latest Economic Bulletin published on 10 August, the  ECB  reiterated that the Governing Council will continue to follow a data-driven approach in determining the appropriate level and duration of restrictive orientation. The  central bank  showed concern about core inflation, calculated net of energy and food, the result of domestic price pressures also due to rising wages and profit margins.",0,1,0,0.3333333333333333
89,"In an interview for Corriere Della Sera, Italy's Economy Undersecretary Federico Freni states that Banca d'Italia Governor  Ignazio Visco  is right to criticise the  ECB  for its prolonged rate hikes. Monetary policy should move with great caution. He added that the geopolitical scenario remains uncertain and that rate hikes should be dosed well to avoid unwanted effects. Inflation, however, is still high. While it is true that the  ECB  and US Federal Reserve's monetary policies often move in tandem, in this case the inflation fundamentals are different and require different choices on interest rates. Mr Freni does not expect strong inflationary consequences on Italy's debt and growth. He predicts more targeted and selective support for energy costs.",-1,-1,-1,-1.0
90,"ECB  Chief Economist Philip Lane said on Tuesday that he anticipates a challenging path to mitigate inflation in energy and food prices but does not expect a significant price surge this autumn. Inflation growth in the euro area is slowing down, though it is too early to declare victory, as more data is required, he said. The possibility of another interest rate hike on 14 September is being discussed, which may mark the end of this tightening cycle due to the deteriorating economic outlook in the euro area. The  ECB  aims to curb inflation in the euro area and bring it to its 2% target through interest rate increases. Mr Lane welcomed the recent estimate showing a decline in the pace of inflation growth in August to 5.3% from July's 5.5% but emphasised the need for this downward trend to continue.",1,1,1,1.0
91,"Milton Friedman, the Nobel Prize-winning economist, had expressed concerns about the challenges of merging multiple sovereign currencies into one, which he believed would eventually lead to the failure of the euro. However, Otmar Issing, a German academic and a key figure in establishing the  ECB , has received a letter from Friedman acknowledging that Issing's efforts might delay the collapse of the euro. Despite surviving longer than Friedman anticipated, the euro has faced persistent challenges, including the sovereign debt crisis and recent periods of turmoil. However,  ECB  President  Christine Lagarde  has acknowledged the unforeseen crises the euro has encountered. Otmar Issing emphasises the magnitude of the task of building a  central bank  from scratch, noting the criticism and doubts from the international press. He also criticises  central banks  for not adequately explaining the limits of their powers during the period of low inflation following the global financial crisis. Issing argues that  central banks  must continue tightening monetary policy until inflation is under control, cautioning against the risks of premature policy changes.",0,0,1,0.3333333333333333
92,"During his opening speech at the 14th MAECI-Banca d'Italia conference, Banca d'Italia Governor  Ignazio Visco  acknowledged that while monetary policy has successfully stabilised expectations thus far, the uncertain geopolitical situation has made predicting future macroeconomic trends increasingly challenging. Monetary policy will therefore have to continue to move prudently, guided by data that will gradually become available, to bring inflation back to the 2% target in the medium term without jeopardising financial stability and minimising the adverse effects on the still fragile recovery. The Governor recalled that the  ECB 's monetary policy stance had significantly changed since the end of 2021 due to the acceleration of price growth. The first step was to announce the reduction of net asset purchases. Throughout 2022, this process has accelerated while avoiding sudden changes in monetary conditions, particularly given the uncertainty caused by the invasion of Ukraine, Mr Visco explained.Â ",0,1,0,0.3333333333333333
93,Latvijas Banka Governor  MÄ,0,0,0,0.0
94,"Speaking at an event in Portugal on Tuesday,  ECB  president  Christine Lagarde  said that Inflation in the euro area is too high and is set to remain so for too long. But the nature of the inflation challenge in the euro area is changing. She stressed that inflation is still too high and it is still too early to declare victory over consumer price rises. “We have made significant progress but — faced with a more persistent inflation process — we cannot waver, and we cannot declare victory yet,” Ms Lagarde added. She also said the  central bank  should make it clear that interest rates will remain ""at these levels for as long as it takes"". According to her, it is unlikely that in the near future the  central bank  will be able to state with full confidence that the peak rates have been reached. This is why  ECB  policy should be decided meeting by meeting and must remain data-dependent, Ms Lagarde underlined. Ms Lagarde stressed that at the  ECB  Governing Council, ""we were clear that two elements of our policy would be key: we would have to bring interest rates to fairly restrictive' levels and keep them there for as long as necessary."" Setting the right ""level"" would be critical to  central bank  monetary policy as it continues the tightening cycle, she argued.",1,1,1,1.0
95,"The long-term lending rules for banks might be up changes, as some  ECB  officials are of the mind that retroactive adjustments could be legally feasible. The basis for existing contracts, which were drawn up in a climate of sluggish inflation and negative borrowing costs, has been eroded by inflation surpassing 10% and the rapid increase in interest rates.  ECB  President  Christine Lagarde  commented in September that a review of  TLTRO  will be “conducted in due course”, leaving the Governing Council’s next meeting on 26-27 October as the next chance to debate the question.",0,0,0,0.0
96,"In an interview, Isabel Camarinha, CGTP Secretary-General, criticised the notion that increased salaries contribute to high inflation rates, labelling it as a ""hoax"". Ms Camarinha argued that speculation and profit margin increases among large economic groups are the real culprits behind rising inflation. She expressed frustration with the  ECB , the  European  Union, and the Portuguese government for perpetuating this narrative while workers face difficulties and major economic groups continue to generate massive profits. Ms Camarinha called for a national day of struggle, demanding higher salaries and highlighting the country's counterproductive development path. She urged workers to unite and demand solutions to their problems for improved lives and national development. On the other hand,  ECB  President  Christine Lagarde  claimed that wage increases are triggering a sustained process of upward convergence of wages, with workers attempting to recoup previous losses suffered from the inflationary shock.",1,-1,-1,-0.3333333333333333
97,Credit agency Fitch has warned high inflation,0,1,1,0.6666666666666666
98,"The Agenda for relevant events for the week of 22-26 May includes US debt ceiling negotiations and several appearances from the  ECB  officials, as the Italian government gears to help households affected by the recent flood. On Monday, data on consumer confidence in the euro area is expected, as well as a speech from  ECB  Chief Economist at a conference on monetary policy. On Tuesday in Frankfurt  ECB  Vice-President  Luis De Guindos  and  ECB  Supervisory Board Chair Andrea Enria are expected to speak at a conference on financial integration, and there will be a meeting between Banque de France Governor  François Villeroy de Galhau  and Deutsche Bundesbank President  Joachim Nagel . On 24 May  ECB  President  Christine Lagarde  will open the Bank's 25th-anniversary celebrations and, finally, on 26 May  ECB  Chief Economist Philip Lane will speak at a conference on inflation.",0,0,0,0.0
