Column1,Manual.summary,Classification Joaquin,Classification Rui,Classification Ed,Average_Classification
0,"Speaking at the IMF in Washington,  ECB  President  Christine Lagarde  reaffirmed her commitment to fighting inflation and warned of the risks to financial stability in the euro area. In order to bring inflation back to 2%, Ms Lagarde announced further interest rate hikes, and declared that the first signs of rising credit risk could already be seen. She also called for fiscal policy measures to be temporary and targeted to be in line with monetary policy. ",1,1,1,1.0
1,"Starting in October, the  ECB  wants to use a new climate score to restructure its portfolio of corporate bonds in such a way that companies with a better climate balance are preferred to those with a worse one. The  central bank  published the relevant details on Monday. According to earlier  ECB  information, the volume involved will be around EUR 30 billion per year over the next few years. Since taking office in November 2019,  ECB  President  Christine Lagarde  has been pushing for the  ECB  to play a more active role in the fight against climate change. However, this is controversial, partly also in the  ECB  Governing Council. The climate score now published is made up of three sub-components: The backward-looking issuance sub-score is based on issuers' past issuances. This examines how the companies perform compared to their peers in a given sector as well as compared to all eligible bond issuers. The forward-looking sub-score is based on the targets the issuers have set for reducing their greenhouse gas emissions. In addition, the climate risk disclosure sub-score assesses issuers' reporting of their greenhouse gas emissions. Greenpeace criticised on Monday that the  ECB  did not take a more rigorous approach and exclude climate sinners and sell their securities. ""Instead, the  ECB  has obviously only opted for cosmetic changes. In this way, it joins the illustrious round of green label swindlers who shun credible climate protection.""",0,0,0,0.0
2,"ECB  Chief Economist Philip Lane has proposed taxing high incomes or corporate profits to fund aid to the weakest to deal with inflation, as this would avoid a growing public deficit. The idea of taxing the wealthiest is already gaining ground within the euro area. Governments should support the income and consumption of those households and firms that are suffering the most, Mr Lane has noted in an interview with Der Standard. ""The big question is whether part of this support ought to be financed by tax increases for those that are better off"", he said, explaining that this could take the form of higher taxes on higher earners or on industries and firms that are highly profitable in spite of the energy shock. The  ECB  is in favour of targeted state aid in order to protect households from the impact of inflation, as  ECB  President  Christine Lagarde  told the  European  Parliament on Monday.",1,0,1,0.6666666666666666
3,"Former German Chancellor Angela Merkel has received the State Prize of North Rhine-Westphalia. In her laudatory speech,  ECB  President  Christine Lagarde  praised Ms Merkel as an exceptional political figure. She is unique, incomparable and inimitable, Ms Lagarde said.",0,0,0,0.0
4,"The  ECB  has raised its interest rates again by 0.25 percentage points. The  central bank  justified this by saying that inflation is continuing to decline but it is still too high. The  ECB  is aiming for an inflation rate of 2%, but ",1,1,1,1.0
5,"Banco de España Governor  Pablo Hernández de Cos  defended the full implementation of the Basel III banking reform package because the Covid-19 crisis was not a real stress test for the banking sector. Mr Hernández de Cos expressed his concern about the time horizon for the implementation of the Basel III reforms in  Europe , hoping that at least it will be 1 January 2025. Regarding the consistency of implementation, Mr Hernández de Cos acknowledged that the  European  Commission's initial proposal included additional deviations to those that already exist in  European  legislation, while the texts approved by the Council and the Parliament did not reduce the number of deviations. Mr Hernández de Cos called for these deviations to be limited as far as possible and for new ones to be introduced.",0,0,0,0.0
6,"In an analysis, IG France Head of Market Research Alexandre Baradez notes that Italy's rates should not deviate too much from Germany's because the  ECB  would have to intervene to avoid stress on government bonds and a new crisis in the euro area.  ECB  President  Christine Lagarde  and the  ECB 's Governing Council are watching what is happening on sovereign bonds, particularly the spread between rates. The current interest rate differential is not worrying yet, but the  ECB  is monitoring it closely. This spread of rates will force the  ECB  to pay attention to its rate hikes and adjust the size of its balance sheet to avoid new bond stress.",1,0,0,0.3333333333333333
7,"Journalist Kristine Aquino points out that, within 24 hours, the US Federal Reserve, the Bank of England and the  ECB  all admitted there is still work to be done to bring inflation under control. They suggested they would consider a pause at some point, but neither of the  central banks  is quite there. But the bond market heard what it wanted: that there will be a pause, Ms Aquino remarks. According to journalist Alexander Weber, there is little to indicate that the  ECB  is close to ending its rate hike cycle from its statements on 2 February. The  ECB  Governing Council intends to raise rates by 50 basis points in March and then reevaluate the situation. In the press conference following the meeting,  ECB  President  Christine Lagarde  tried to dispel the notion that the  ECB  is close to being done. Ms Lagarde said there was more ground to cover. The concerns about core inflation and wage growth accelerating point to further tightening measures, Mr Weber believes. He adds that if the tightening message does not filter through to the market, hawkish  ECB  Governing Council members could reassure market participants that the  ECB  will continue to hike its rates. Ms Aquino suggests that the markets could be questioning whether the  ECB  can stay the course when the Fed has already hinted at a soon end of the rate hike cycle.",1,1,1,1.0
8,"An opinion piece on inflation in the euro area argues that the  ECB  fears a repeat of the 2012 crisis and has taken the lead by working on a tool to stabilise the interest rate differentials between the various public debts. The Italian ten-year rate, which had risen to 4.20% in mid-June, has come down. The country now has a ten-year debt of 3.10%, while Germany borrows at 1.12% and France at 1.64%. However, the rates could rise again due to inflation. In June, inflation reached 8.6% year-on-year in the euro area.  ECB  President  Christine Lagarde  has already announced a rate hike for the  ECB 's meeting on 21 July. Deutsche Bundesbank President  Joachim Nagel  is pushing for a sharp and rapid rise in interest rates to combat inflation and the weakness of the euro. In mid-June,  ECB  Executive Board Member  Isabel Schnabel  said that the risk of fragmentation would only disappear with the evolution of the institutional architecture of the euro area.",1,1,1,1.0
9,"During the press conference on Thursday where it was decided to raise interest rates by 25 basis points,  ECB  President  Christine Lagarde  emphasised that the euro area economy outlook remains uncertain due to several factors, including the possibility that the  ECB  monetary policy effects would prove stronger than expected, accentuating downside risks. Ms Lagarde also explained that the large  TLTRO  repayment in June went smoothly, as banks were well prepared.",1,1,1,1.0
10,"ECB  Executive Board member  Fabio Panetta  has signalled that although there will be further interest rate increases, the  central bank  is not far from the end of the monetary policy tightening cycle, reports Bloomberg.",1,1,0,0.6666666666666666
11,"AllianzGI Global Head of Bond Investments Franck Dixmier anticipates that the  ECB  will increase interest rates by 25 basis points at its meeting on Thursday, 14 September, despite the slowdown in the euro area economy, as underlying inflation remains too high. ""The  ECB , having raised interest rates by a total of 425 basis points (bp) since July 2022, is no longer on autopilot. It now has two options: pause or continue to limit monetary conditions,"" he added. Mr Dixmier noted that growth and inflation forecasts would be announced at the September meeting, but an upward revision of the inflation outlook is expected. Another factor causing concern for the  central bank  is that the market's confidence in its ability to achieve its objectives is gradually fading, with inflation expectations slightly deviating. According tovMr Dixmier, the time is right to continue tightening monetary conditions, and  ECB  President  Christine Lagarde  is expected to announce another 25 basis points rate hike at the September meeting.",1,1,1,1.0
12,"In an interview with Irish broadcaster RTE on Saturday,  ECB  Chief Economist Philip Lane said that the  central bank  will raise interest rates “several” more times. Citing his institution’s projections, Mr Lane noted that a mild recession in the euro area cannot be ruled out. In September, the  ECB  tightened policy by a historic 75 basis points and Deutsche Bundesbank President  Joachim Nagel  said earlier on Saturday that borrowing costs will need to increase a lot more to get inflation under control.",1,1,1,1.0
13,"On 18 January, new signals on monetary policy and analyst ratings weighed heavily on real estate values. After the  central banks ' interest rate turnaround caused the sector to collapse last year, it began to recover in October but now that growth is faltering. Recent  ECB  officials' statements were the reason. For example,  ECB  Governing Council Member  FranÃ§ois Villeroy de Galhau  dismissed market speculation about a possible interest rate hike of only 0.25 percentage points in March. Moreover, he confirmed that  ECB  President  Christine Lagarde 's comments on future interest rate increases by 0.5 percentage points are still valid.Â ",1,1,0,0.6666666666666666
14,"On 18 November,  ECB  President  Christine Lagarde  pointed out that the risk of a recession in the euro area had increased. She recalled that a recession was unlikely to significantly reduce inflation in a context of uncertainty. Meanwhile, Banca d'Italia Governor  Ignazio Visco  pointed out that the need to continue with the restrictive monetary policy was evident, although the reasons for following a less aggressive approach were gaining ground. For his part, Banco de España Governor  Pablo Hernández de Cos  recognised that the  ECB  must think about the possibility of a recession. On 15 December, the members of the  ECB  Governing Council will decide whether to carry out the measure.",1,1,1,1.0
15,"Lietuvos bankas Chairman of the Board  Gediminas Šimkus  has stated that the market's expectations of an upcoming interest rate reduction by the  ECB  are overly optimistic. According to him, a positive change in price growth is necessary for a swift reduction in interest rates. Although there was some positive news regarding price growth, the macroeconomic projections of the  ECB  did not indicate a significant change in the medium-term outlook. The  ECB 's Governing Council decided not to change the three main interest rates, which will remain at 4%, 4.5%, and 4.75% respectively.  ECB  President  Christine Lagarde  confirmed that the Governing Council did not discuss reducing interest rates at all, and she warned that monetary policymakers should remain vigilant in the fight against inflation.",1,1,0,0.6666666666666666
16,"Part of the excessive delay in starting up many public investments is explained by the greater care and greater demand that now exists in the application of project financing compared to what happened in the past, argued Banco de Portugal Governor  Mario Centeno  in a debate held on 25 May in Lisbon. Mr Centeno insisted that it is necessary to speed up the implementation of funds, but urged caution not to make some serious mistakes. He pointed out that Portugal ended up paying for roads where citizens will never walk, and for stadiums that are empty, and that is public investment. On the panel were Mr Centeno, Banco de España Governor  Pablo Hernandez de Cos , EIB Vice-President Ricardo Mourinho Félix, and EIB Chief Economist Débora Revoltella.",0,0,0,0.0
17,"Tracker mortgages in Ireland have seen a significant increase in costs over the past year following the rate hikes by the  ECB . The average tracker mortgage has risen from 1.15% to 5.15%, resulting in a 20% increase in repayments.  ECB  President  Christine Lagarde  emphasised that further rate hikes are likely as the bank aims to reach its inflation target of 2% or less. The US, UK, Canadian, Australian, and New Zealand  central banks  have also implemented rate hikes. Borrowers with tracker mortgages are encouraged to explore fixed-rate options to potentially reduce their repayments, with rates as low as 3.63% available. Switching activity has declined, but mortgage experts advise homeowners to review their options to secure more favourable rates.",1,1,1,1.0
18,"ECB  President  Christine Lagarde  has signalled that the  central bank  will be ""decisive"" in its actions, which will allow it to respond appropriately to inflation threats, but also help financial markets in the event of emerging dangers.",1,1,1,1.0
19,"Mortgage holders are anticipating a potential tenth consecutive interest rate increase by the  ECB  amidst concerns about inflation. The  ECB 's decision hinges on the speed at which inflation retreats, with updated projections for the euro area's economic outlook through 2025 being a crucial factor. Money markets favour another increase with two-in-three odds.  Policymakers including Banco de Portugal Governor  Mário Centeno  fret that another rise in borrowing costs would imperil  Europe 's struggling economy. Others, such as Národná banka Slovenska Governor  Peter Kažimír , reckon inflation would not return to the 2% target without a further move.  ECB  President  Christine Lagarde  will provide more clarity in a press briefing following the announcement.",1,1,1,1.0
20,"The wait for US macro data kept the  European  stock exchanges frozen, with little movement in the early hours of Thursday's session. Investors were also waiting for the words of  ECB  President  Christine Lagarde . Speaking from Frankfurt, Ms Lagarde gave no indications on monetary policy. She did, however, say that the financial system has managed to avoid serious systemic risks. Meanwhile, in the United States, further rate hikes seem to be ruled out, although the Federal Reserve, according to some observers, would not be in a hurry to proceed with cuts.",0,0,0,0.0
21,"In an opinion article, journalist Ana Sá Lopes comments on the  ECB 's monetary policy. The author recalls that  EU  member states have defined in the  European  treaties that the  ECB  is independent and does not have to answer to anyone. She adds that there has been criticism of the course of monetary policy from the Portuguese Prime Minister, President and parties. Ms Sá Lopes stresses that while the  ECB  is pursuing a policy aimed at cutting wages, Portuguese banks have seen an opportunity to profit from rising interest rates.",0,-1,0,-0.3333333333333333
22,"Banque de France Governor  FranÃ§ois Villeroy de Galhau  expects the  ECB  to raise interest rates further in the coming months in its fight against high inflation. ""In 2023, new interest rate hikes at a pragmatic pace will very likely be necessary in the coming months to bring inflation towards 2%,"" Mr Villeroy de Galhau told the French Senate's Finance Committee on 11 January. In a presentation for a conference in Vienna on the same day, Oesterreichische Nationalbank Governor  Robert Holzmann  said that the  ECB  must raise interest rates significantly further to reach a sufficiently restrictive level. That was necessary to achieve a timely return of inflation to the  ECB 's medium-term target. Mr Holzmann does expect inflation in the euro area to weaken. However, due to a high level of uncertainty, risks remained on the upside, he said. Meanwhile,  ECB  President  Christine Lagarde  has held out the prospect of further interest rate hikes. Ms Lagarde has signalled that increases of half a percentage point each would probably also be on the agenda at the upcoming meetings.",1,1,1,1.0
23,"On 15 December, after the  ECB  moderated its tightening pace to a 50 basis point hike as expected,  ECB  President  Christine Lagarde  upped her inflation-fighting tone and pledged that further “significant” hikes are coming. Ms Lagarde dispelled any unclarity by saying that the  central bank  would continue to raise interest rates significantly and steadily “for a long period of time”, without suggesting how high they could go. She also explained that despite the  ECB , US Federal Reserve and Bank of England all raising rates by 50 basis points simultaneously, they are not changing strategy at the same time. While the other  central banks  have hinted at slowing the tightening pace, Ms Lagarde emphasised that the  ECB  is “not changing direction”.",1,1,1,1.0
24,"According to  ECB  President  Christine Lagarde , the wage increase will require constant monitoring by the  central bank .",0,1,1,0.6666666666666666
25,"In an interview, UK journalist Paul Mason argues that during the Greek financial crisis, he and others considered  ECB  President  Christine Lagarde  and former  ECB  President Mario Draghi enemies of progress because of their support of austerity measures. However, today they are regarded as essential allies. Mr Mason asserts that the current threat of fascism could be undermined through a new Washington Consensus on Social Justice, supported by Ms Lagarde, US President Joe Biden and  European  Commission President Ursula von der Leyen. ",0,0,0,0.0
26,"During the press conference after the  ECB  Governing Council monetary policy meeting, President  Christine Lagarde  said that interest rate hikes in July would probably continue as the target has not yet been reached. Consequently, a pause is not being considered.",1,1,1,1.0
27,"On Thursday, the  ECB  raised its interest rates by 50 basis points. The decision comes at a time of maximum stress for the financial markets. Until a few days ago, the 50 basis point increase, anticipated by its President  Christine Lagarde  at the last Governing Council meeting, was taken for granted. The Governing Council, however, confirmed it is closely monitoring the ongoing tensions in the markets, adding that it is ready to intervene where necessary to preserve price stability and financial stability in the euro area. It also emphasises that the euro area banking sector is resilient, with solid capital and liquidity positions. Regarding the next steps, there are no direct hints but reliance on data policy. For Altaf Kassam of State Street Global Advisors, it is a concession to the rapid tightening of financial conditions that appears to be the suspension of  forward guidance  in favour of a data-dependent approach at individual meetings.",1,1,0,0.6666666666666666
28,"While headline inflation in the euro area has decreased to 5.3% in July,  ECB  hardliners, including Deutsche Bundesbank President  Joachim Nagel  and De Nederlandsche Bank President  Klaas Knot , advocate waiting for core inflation to significantly drop from its current 5.5% before halting interest rate hikes, a commentary reads. However, focusing on core inflation might be misleading, as it tends to trail headline inflation. Additionally, headline inflation better reflects consumer expectations, influencing future price trends. With a record-high deposit rate and economic fragility,  ECB  President  Christine Lagarde 's commitment to data-dependence suggests that considering the right indicators is crucial to avoid unintended economic repercussions.",1,1,1,1.0
29,"In a commentary about inflation and the efforts to address it, columnist Agis Veroutis notes that Milton Friedman used to say in the 1970s that the only way to reduce inflation is by cost-cutting measures of the state. Mr Veroutis notes that Mr Friedman knew what he was talking about, contrary to Deutsche Bundesbank President  Joachim Nagel .Â  The increase of rates by itself is not enough to address inflation, Mr Veroutis claims. The  ECB  raised the rates by another 50 base points, adversely affecting those who have a hard time servicing their debts and are unable to consume. Those with a backup will continue spending. It looks like Germany and the satellite countries to address inflation by exporting austerity to the other euro area's member states, the commentator notes. One cannot go out of the moving sand by just pulling the strings of shoes, he adds. The inflation will not drop unless the euro area countries cut expenses, he underlines.",-1,1,-1,-0.3333333333333333
30,"Interest rates are relatively high and will probably remain so for some time despite falling inflation. Deutsche Bundesbank President  Joachim Nagel  told ZDF that it is too early to think about rate cuts. He believes that inflation might reach the  ECB 's target in 2025, which is ""the good news"". As for the German economy, it must now address structural issues such as demography, digitalisation and decarbonisation. ""We now have to roll up our sleeves and tackle the issue. And then I'm not worried about the German economy,"" says Mr Nagel.",1,1,1,1.0
31,"On 1 December, Banco de España Governor  Pablo Hernández de Cos  put the cost of inflation for the Spanish economy at around three GDP points in 2022 as a whole, which is around EUR 40 billion that Spain has to pay more abroad due to the increase in the cost of goods that it does not produce. According to data from the quarterly central balance sheet, which takes information from around 1,000 companies, companies were not able to pass on all the cost increases they had due to the rise in energy and raw material prices. Intermediate costs soared by more than 50% until September, and the margin on sales fell compared to 2021.",1,0,0,0.3333333333333333
32,"According to the minutes of the  ECB 's latest meeting, published on Thursday, some  ECB  Governing Board Members would have preferred a more aggressive interest rate rise than the 25bp hike announced in June due to the risk of persistently high inflation in the euro area. There was a broad consensus in favour of the 25 basis point rate hike proposed by  ECB  Chief Economist Philip Lane, but a preference was also initially expressed for a 50 basis point increase in the key  ECB  interest rates, given the risk that high inflation would become more persistent. At the press conference following the  ECB  Governing Council meeting,  ECB  President  Christine Lagarde  stated that it was very likely that the  ECB  would raise rates again in July. ",1,1,1,1.0
33,"On 4 May, the  ECB  Governing Council raised key interest rates in the euro area by 0.25 percentage points. After the monetary policy meeting,  ECB  President  Christine Lagarde  pointed out that the euro-area  central bankers  were not pausing their tightening course. All  ECB  Governing Council members were determined to fight high inflation, Ms Lagarde underlined. ""There will be one or two more steps in the euro area, then a pause,"" DekaBank Chief Economist Ulrich Kater suggested.  ECB  Chief Economist Philip Lane recently emphasised that euro-area inflation had been above the  central bank 's target since mid-2021. Mr Lane warned that the more prolonged inflation stayed too high, the greater the risk that euro-area citizens would lose confidence in the  ECB 's ability to return to its 2% target. The  ECB 's rate hikes are unlikely to be over ""because prices in the euro area are still too high,"" Association of German Banks Chief Executive Heiner Herkenhoff warned. ""The longer inflation remains at this level, the more drastic the burdens will be for citizens, companies and economic development,"" Mr Herkenhoff stressed. Finally, the  ECB  also decided not to reinvest the maturing bonds purchased under the APP from July onwards.",1,1,1,1.0
34,"Just over a month ago, the  ECB  published an analysis of the budgetary impact of the measures adopted by the euro area member states to deal with the economic effects of the invasion of Ukraine. According to the authors' calculations, only 12% of these tax cuts and spending increases benefit vulnerable households; and less than 2% will directly contribute to the ecological transition. The probability that the need for compensatory measures extends to 2023 means that these measures will have to be altered. The increase in interest rates by the  ECB  may be a particularly painful and not very efficient medicine against the spiking prices since their origin is not an overheating of the  European  economy. More measures are needed: specifically, a reform of the energy price fixation mechanisms and an income pact.",-1,-1,-1,-1.0
35,"Banque de France Governor and  ECB  Governing Council member  François Villeroy de Galhau  has once again declared that the  ECB  has ended increasing interest rates. In his words, the decision to hike interest rates fully played the role of a cure for the disease that is inflation. Therefore, unless there are new shocks, there will be no further increase in rates. The issue of reduction may arise in 2024, but not now, he added.",-1,-1,-1,-1.0
